review_content,simplified_review
[1028 / 傳明酸亮透美白粉餅SPF50★★★]我買的是迷你版4g/迷你版好像只有粉陶色 沒得挑色其實我在藥妝店看過他幾次 SPF50有吸引我但對於這玩具般的粉餅而且看起來好像沒粉撲?我沒有信心阿~所以沒有考慮也沒去摸過結果某天去光南東西，看它特價99元--就忍不住手滑了~~買了才發現他比我想像中的好用耶好處是粉很細很細餅壓又得很實 完全不會飛粉(應該說連沾取都要用點力)塗在臉上沒有悶感而且原本擔心顏色太白 但也不會 因為它的顏色還挺透明的耶!可以說它透明到我覺得它像蜜粉餅耶?為什麼是粉餅啊我不懂但對我來說是好事啦因為這一小小盒我也只打算帶出門補妝用 所以粉體透明度高、補妝比較自然(如果沒有畫線可能看不太出來哪邊有上粉吧?而且是厚厚抹了三次喔! 答案是左邊 )缺點是持妝度 我覺得不是他的強項 如果臉出油嚴重的時候不小碰到臉 它應該就會消失了其中可取的是它不會變成土石流或結塊--而是就默默消失了(?)然後迷你版的粉撲放不進粉盒應該是很多人的困擾 這部分我就把迷你粉撲放在它自己原本的小包裝袋和迷你粉餅一起丟進化妝包 還挺不占位置的。但這迷你粉撲質地真的...用幾次就該丟了吧我想之後打算自己去買粉撲放夾鏈袋中，再和這盒粉餅一起丟進化妝包 就OK拉(OK我知道照片中的粉撲很髒--因為拿來推開殘妝所以黑黑--等我買了新粉撲我就要丟掉它了>,是迷你版4g/迷你版好像只有粉陶色 沒得挑色其實我在藥妝店看過他幾次 SPF50有吸引我但對於這玩具般的粉餅而且看起來好像沒粉撲?我沒有信心阿~所以沒有考慮也沒去摸過結果某天去光南東西
由於我愛用的原生美肌已經退出台灣了Q_Q外加粉餅已絕 定妝用的粉也快沒了看到小三美日推出蜜粉+贈1028卸妝乳 才199元的促銷看完試用品片覺得十分心動 買來當過度期的蜜粉這次KITTY限定版一共有三色淺藍色已經斷貨QAQ 超可愛由於不愛粉色的我 買了紅色版的KITTY十分貼心贈送滿大罐的卸妝乳！說實在真的十分小巧 攜帶也方便但粉撲真的超容易髒 我才用不到一週就有點髒了=_=.....控油效果的確很好 上完蜜粉後不太會出油 尤其一直在工作的狀況下也滿控油的粉質很薄透 很適合目前我喜歡的清透妝感不過由於我還是認為這款是我的過渡期替代用蜜粉/粉餅之後回購狀況還是有待觀察XDDD價格親民度：★★★★☆(限定版原價NT249，以NT199購入)服貼度：★★★★★吸油度：★★★★☆持妝度：★★★★☆回購率：70%,原生美肌已經退出台灣了Q_Q外加粉餅已絕 定妝用的粉也快沒了看到小三美日推出蜜粉+贈1028卸妝乳 才199元的促銷看完試用品片覺得十分心動 買來當過度期的蜜粉這次KITTY限定版一共有三色淺藍色已經斷貨QAQ 超可愛由於不愛粉色的我 買了紅色版的KITTY十分貼心贈送滿大罐的卸妝乳！說實在真的十分小巧 攜帶也方便但粉撲真的超容易髒 我才用不到一週就有點髒了=_=控油效果的確很好 上完蜜粉後不太會出油 尤其一直在工作的狀況下也滿控油的粉質很薄透 很適合目前我喜歡的清透妝感不過由於我還是認為這款是我的過渡期替代用蜜粉/粉餅之後回購狀況還是有待觀察XDDD價格親民度：★★★★☆服貼度：★★★★★吸油度：★★★★☆持妝度：★★★★☆回購率：70%
"哇哇哇 外包裝整個超吸引人的啦紫色蛉盒加上粉色的粉盒cute!!!!!!^^在掌心以內 小小的一盒很方便攜帶4.6g原價199 便宜但容量蠻小的一分錢一分貨囉!!!原本我是不用""蜜粉餅""""的但是這款外型可愛又強打超控油馬上買一個來用用這款蜜粉真的很控油夏天這麼悶熱我沒什麼出油 頂多是汗水可以說是比面X蜜粉好用了但是有一個缺點粉撲沒有帶子可以扣住手指 我覺得不好用就去買了有帶子的粉撲(40mm)","啦紫色蛉盒加上粉色的粉盒cute^^在掌心以內 小小的一盒很方便攜帶4.6g原價199 便宜但容量蠻小的一分錢一分貨囉原本我是不用""蜜粉餅""""的但是這款外型可愛又強打超控油馬上買一個來用用這款蜜粉真的很控油夏天這麼悶熱我沒什麼出油 頂多是汗水可以說是比面X蜜粉好用了但是有一個缺點粉撲沒有帶子可以扣住手指 我覺得不好用就去買了有帶子的粉撲"
上週臨時起意台南小旅行遠離台北連日來令人憂鬱的陰陰雨雨～出發前晚閒逛小區時看到最近版上分享的1028超吸油蜜粉餅看照片還不覺得怎樣，但盒子本人真的好迷你好可愛呀~我原本是用歌劇魅影的蜜粉，但最大的缺點是每次旅行把蜜粉盒放在化妝包裡不僅佔空間還會把其他東西也弄得白白粉粉真的很崩潰! 於是花了三秒的時間用這個理由讓自已合理化的購入了，誰叫它的價錢跟外觀一樣可愛呢!! 剛好也缺高係數的防曬來抵抗台南赤炎炎的日頭，所以順便手滑了全效美白防曬隔離乳但蠻意外的是全效美白防曬隔離乳的質地還蠻清爽的左邊可以看到我臉上其實有點斑~右邊擦上防曬乳後再上一層蜜粉 感覺毛孔明顯變小~妝容也很自然全臉使用蜜粉餅定妝，感覺毫無油感很自然~而且一整天下來後感覺臉上油光真的有改善我自己是乾性肌但T字易油，所以每天中午跟傍晚都會用粉餅按壓T字的部分補妝剛補完粉感稍重，眼尖的同事一看就知道我剛跑去補妝…..最近改用超吸油蜜粉餅定妝，中午一看泛油的程度還蠻明顯有改善的耶沒有想補妝的衝動到了傍晚會稍微補一下T字部位，補完也沒什麼粉感蠻自然的其實我是第一次使用主打吸油的產品，對它的能耐非常好奇於是無聊的拿了手邊不知如何處置的精油贈品來挑戰它的能耐矛盾大對決：油膩膩精油vs超吸油蜜粉餅,陰陰雨雨～出發前晚閒逛小區時看到最近版上分享的1028超吸油蜜粉餅看照片還不覺得怎樣
這塊粉餅是在奇摩購物中心買的當時有很多1028的優惠組合，像是粉底液配蜜粉、隔離霜配粉餅之類的組合還有眼影+眼線的組合，印象中這些組合都不超過500大洋所以我失心瘋的瘋狂搶購啊XD不過沒有到限量版的盒子有點小失望，因為限量版的盒子真的太可愛了啊！粉餅是採上下層的設計，上面是粉餅下面是粉撲這款粉餅有出三個色號，分別是：01淺陶色(白皙色調膚色)02粉陶色(中間色調偏粉膚色)03柔陶色(中間色調偏米黃膚色)我入手的是01淺陶色洗完臉做完基礎保養，擦了一層EH超合一30秒粉凝霜使用1028傳明酸亮透美白粉餅後 它的妝感真的很薄透，可是遮瑕力卻也不差上完粉凝霜後臉上還是有瑕疵，再蓋上一層這個粉餅，瑕疵也有少掉一半左右而且它的粉體很細，比很多專櫃的粉餅粉質還要細膩擦上後很服貼也沒有浮粉或是脫妝的困擾(前提是保濕要做好)再加上它的高防曬係數，讓我儘管在大太陽底下也不會擔心被曬黑妝感也真的很薄透，不會因為補妝次數較多就厚到像面具一樣持久度也不錯，外出一整天回到家還有保持8-9成的妝感(外出會一直補妝並不適因為脫妝，而是因為要防曬啦XD)使用起來的效果跟專櫃的粉餅有得比，但是價錢卻比專櫃的粉餅親民的多是塊很不錯的粉餅！用完會回購！！,當時有很多1028的優惠組合，效果跟專櫃的粉餅有得比，但是價錢卻比專櫃的粉餅親民的多是塊很不錯的粉餅！
便宜好用，粉質算細ㄉ，控油效果中上，不太卡粉，遮瑕效果中等，持久力也中等,便宜好用，粉質算細ㄉ，控油效果中上，不太卡粉，遮瑕效果中等，持久力也中等
已經用了一陣子的蜜粉餅 因為不是每天化妝 所以用量很省多在有出門較長時間時用 這款蜜粉小巧攜帶方便 內有鏡子方便補妝附的粉撲也滿好用的 蜜粉餅是自然膚色 擦上後很自然服貼 持妝控油效果滿好的也不會過乾 偶爾補一下就好了 是好用的蜜粉餅,蜜粉餅 因為不是每天化妝 所以用量很省多在有出門較長時間時用 這款蜜粉小巧攜帶方便 內有鏡子方便補妝附的粉撲也滿好用的 蜜粉餅是自然膚色 擦上後很自然服貼 持妝控油效果滿好的也不會過乾 偶爾補一下就好了 是好用的蜜粉餅
趁屈臣氏在特價一盒16X元的時候買的淡紫色的粉體正好修飾我黃黃的肌膚除了定妝之外真的會有一種皮膚好好亮一階的感覺(和白一階不一樣喔皮膚感覺是透的如果上底妝之前有用潤色隔離乳上薄薄一層效果會更明顯喔~~~整體上用起來很不錯也不會卡粉減一顆星是因為真的天氣太熱的話臉還是會有點出油但這個是OK的臉看起來也不會泛油光喔推薦給大家試試最近有在特價~~~可以去藥妝店挖寶一下XD,時候買的淡紫色的粉體正好修飾我黃黃的肌膚除了定妝之外真的會有一種皮膚好好亮一階的感覺(和白一階不一樣喔皮膚感覺是透的如果上底妝之前有用潤色隔離乳上薄薄一層效果會更明顯喔整體上用起來很不錯也不會卡粉減一顆星是因為真的天氣太熱的話臉還是會有點出油但這個是OK的臉看起來也不會泛油光喔推薦給大家試試最近有在特價可以去藥妝店挖寶一下XD
剛開始學化妝買的蜜粉，因為本身T字部位容易出油，所以在化妝後定裝使用，但是他本人雖然說是透明的，但是剛開始拍在臉上真的會有一層神祕的白，雖然不明顯，但是就...怪怪的~在臉上自然出油之後就好多了，但是它定裝的效果就..跟價格差不多，無法控制我繼續大出油，只能做到吸油吧?本身付的粉撲超薄，用起來不怎麼優，但是有付鏡子還算小小小貼心吧?因為產品本人很小，適合不是很會出油的人隨身攜帶，或是當成瀏海急救包，可以拯救被安全帽壓到出油的水水。,蜜粉，效果就跟價格差不多，無法控制我繼續大出油，只能做到吸油吧?本身付的粉撲超薄，用起來不怎麼優，但是有付鏡子還算小小小貼心吧?因為產品本人很小，適合不是很會出油的人隨身攜帶，或是當成瀏海急救包，可以拯救被安全帽壓到出油的水水。，使用，但是他本人雖然說是透明的，但是剛開始拍在臉上真的會有一層神祕的白，雖然不明顯，但是就怪怪的~在臉上自然出油之後就好多了，但是它定裝的效果就跟價格差不多，無法控制我繼續大出油，只能做到吸油吧?本身付的粉撲超薄，用起來不怎麼優，但是有付鏡子還算小小小貼心吧?因為產品本人很小，適合不是很會出油的人隨身攜帶，或是當成瀏海急救包，可以拯救被安全帽壓到出油的水水。
我是買裸色系的，顏色比我的膚色黑，但不知道有沒有很明顯，每次都忘記問身邊的人這個問題。上妝後在我最乾的那小區會覺得有點乾，可是控制一下那區的用量，或是擦個保濕也行夏天騎車到目的地後拿下安全帽後，怎麼臉都是汗，擦掉汗後妝還是很完整，超抗汗的拉~,我是買裸色系的，顏色比我的膚色黑，但不知道有沒有很明顯，每次都忘記問身邊的人這個問題。上妝後在我最乾的那小區會覺得有點乾，可是控制一下那區的用量，或是擦個保濕也行夏天騎車到目的地後拿下安全帽後，怎麼臉都是汗，擦掉汗後妝還是很完整，超抗汗的拉~
1028的粉餅我身邊的朋友幾乎人人都有 他們家的東西 我其實沒有特別喜歡除了眼線筆我覺得不錯以外 其他都還好但這一塊我是用了朋友之後 才開始愛上他cp值算蠻高的雖然粉質沒有很細 但是他的遮瑕力很夠 也很控油定妝防曬效果我自己覺得沒有很顯著但整體來說是值得購買的,粉餅我身邊的朋友幾乎人人都有 他們家的東西 我其實沒有特別喜歡除了眼線筆我覺得不錯以外 其他都還好但這一塊我是用了朋友之後 才開始愛上他cp值算蠻高的雖然粉質沒有很細 但是他的遮瑕力很夠 也很控油定妝防曬效果我自己覺得沒有很顯著但整體來說是值得購買的
從小容量到大容量我都用過了哈哈哈以前很愛這款優點：不會乾也不會起屑好上手缺點：色號少、妝感厚重印象中持妝度沒有很好高中的時候都會補妝容量小的真的用很快，之後都買大容量的了沒有美白我是沒感覺啦哈哈哈因為基本上我都還會擦防曬使用的過程中沒有致痘痘現象也不會過敏，我是因為他而開始陸續購入他們家的產品我本身是白皮膚所以用01就夠了用自然色看起來比較黑可是不知道為什麼後來都買不到了滿可惜的，cp值算高適合新手購入,時候都會補妝容量小的真的用很快
這是朋友送我的禮物，已經用好久了很喜歡也覺得很好用！我用的是02粉陶色，自然肌完美適用我一直以來都是用刷具上妝，所以遮瑕效果不清楚主要是拿來定妝使用粉質細緻，霧面妝感不會改變底妝，是很自然的定妝控油沒感覺，夏天我依舊爆油，然後就會土石流式脫妝美白當然也沒有啦，不可能靠粉餅美白哈哈哈但是要稱讚這款不會暗沉！真的很怕會暗沉的粉餅，是嫌我皮膚不夠黃嗎 T__T另外我很愛的是SPF50的防曬係數因為我真的超懶、超不愛擦防曬或者有時想到的時候已經來不及了，底妝都上了所以可以在最後定妝時補個防曬，真是恩典啊～XD小小的有附鏡子，很方便攜帶價格實惠，CP值很高，推薦！,禮物，效果不清楚主要是拿來定妝使用粉質細緻，霧面妝感不會改變底妝，是很自然的定妝控油沒感覺，夏天我依舊爆油，然後就會土石流式脫妝美白當然也沒有啦，不可能靠粉餅美白哈哈哈但是要稱讚這款不會暗沉！
外包裝 跟附贈的粉撲是無可挑剔左邊是素顏單上了修片餅右邊是素顏這款的提亮度很自然全臉使用也不會誇張能讓皮膚有澎潤感最喜歡的是不顯皮膚紋理能修飾毛孔用量也很省外出補妝很方便但持久度就還好而已但跟其他蜜粉比持久力是差不多的但整體而已是很厲害的,粉撲是無可挑剔左邊是素顏單上了修片餅右邊是素顏這款的提亮度很自然全臉使用也不會誇張能讓皮膚有澎潤感最喜歡的是不顯皮膚紋理能修飾毛孔用量也很省外出補妝很方便但持久度就還好而已但跟其他蜜粉比持久力是差不多的但整體而已是很厲害的
"終於呀！我把這塊蜜粉餅用完了??先說一下，我個人會買完全是因為屈臣氏當時有折扣，加上我妹她想買，又因為貪心比較便宜的問題就入手了！使用起來，並沒有太所謂吸油的感受啦！主要是搭配理膚寶水的防曬液在使用，減少臉上的黏膩感，加上輕巧方便,不佔空間的問題，才一直一直努力的用完他！畢竟拿空瓶才更有理由買新的呀！??",問題就入手了！使用起來
這是我購入的第一個氣墊粉餅，我買的是偏白的明亮膚色，目前已經使用了將近四個月。因為我是混和偏油的肌膚，一開始還有點擔心氣墊粉餅對我的皮膚來說會不會太過滋潤，看在這樣產品有主打控油、上網查了下評價普遍都不錯，被燒到就下手購入XD必須先說，它對我來說控油效果沒有很顯著，我還是必須在上氣墊粉餅前使用控油的妝前乳、控油定妝也要做得確實，這樣一來大概從早上八點上妝後，可以保持清爽不油膩到下午兩點左右，再來就會需要用衛生紙壓油光、或是使用吸油面紙才不會整臉油亮亮。另一點是，通常我都是輕拍在臉上，整體妝感非常薄透，換句話說，也就是遮瑕力不高。我的臉上有些痘痘留下來的小暗沉，即便先上過飾底乳校正膚色後再拍上氣墊粉餅，無法輕拍一層就蓋住，不過可能也是因為我沒有反覆疊擦(很怕妝感太重。整體而言，我覺得這塊氣墊粉餅，在提亮的部分表現得很棒！狀感薄透自然、不會看起來像戴了面具，缺點是控油效果還有遮瑕效果偏弱。最後順帶一提，在購入氣墊粉餅以後，我才在網路上看到一個有關粉底類產品生細菌的比較影片，發現越是濃稠、或液態類產品有些容易滋生細菌，氣墊粉餅便是其中一個案例，相較之下，乾的固態粉餅比較不會有這樣的問題。於是我後來就不用氣墊粉餅附帶的氣墊粉撲，改買了一塊透明粉撲來上妝，免去需要花時間清洗氣墊粉撲的麻煩，畢竟透明粉撲沖一沖就很乾淨了XDD,第一個氣墊粉餅，效果沒有很顯著，我還是必須在上氣墊粉餅前使用控油的妝前乳、控油定妝也要做得確實，這樣一來大概從早上八點上妝後，可以保持清爽不油膩到下午兩點左右，再來就會需要用衛生紙壓油光、或是使用吸油面紙才不會整臉油亮亮。，使用了將近四個月。
"之前無意間去小屈看到它在特價，加上一直有人跟我推薦它真的很好用~~想說好吧，就買來用用看吧!!首先體型部分~真的是小巧玲瓏，外出的時候真的方便攜帶，放在包包裡也不太佔空間唷~既然它是主打""超吸油""""，那我就要來好好看看他到底對我來說能多吸油先說一下我是不管春夏秋冬、乾濕冷熱，鼻子都會出油很嚴重的人以前有用過惹O、MISS HXNX的蜜粉餅前者表現不錯，在學校追趕跑跳一整天都沒什麼出油，不太需要補，缺點就是會顯得太白了，然後沒有防曬後者則是擦了之後我也不知道他到底有沒有在吸油 XD 外觀做得很精緻這樣，但是印象中它好像有防曬~而1028這款蜜粉餅對我來說，也算是蠻控油的~大概早上到下午都算撐得住(以學生滿堂課來說)不過夏天的時候中午過後可能視情況補一下，但大致上都還算滿控油的而且擦了這個也不會說臉會太白還怎麼樣，整個看起來就是蠻自然的~用量也蠻省的~(因為我也還沒到油田的地步)整體表現都還不錯、價錢也是很親民不過因為它沒有防曬係數，所以後來就送人了但我覺得如果不在意有沒有防曬功能的人倒是可以考慮這款""","之前無意間去小屈看到它在特價，加上一直有人跟我推薦它真的很好用~~想說好吧，就買來用用看吧!!首先體型部分~真的是小巧玲瓏，外出的時候真的方便攜帶，放在包包裡也不太佔空間唷~既然它是主打""超吸油""""，那我就要來好好看看他到底對我來說能多吸油先說一下我是不管春夏秋冬、乾濕冷熱，鼻子都會出油很嚴重的人以前有用過惹O、MISS HXNX的蜜粉餅前者表現不錯，在學校追趕跑跳一整天都沒什麼出油，不太需要補，缺點就是會顯得太白了，然後沒有防曬後者則是擦了之後我也不知道他到底有沒有在吸油 XD 外觀做得很精緻這樣，但是印象中它好像有防曬~而1028這款蜜粉餅對我來說，也算是蠻控油的~大概早上到下午都算撐得住(以學生滿堂課來說)不過夏天的時候中午過後可能視情況補一下，但大致上都還算滿控油的而且擦了這個也不會說臉會太白還怎麼樣，整個看起來就是蠻自然的~用量也蠻省的~(因為我也還沒到油田的地步)整體表現都還不錯、價錢也是很親民不過因為它沒有防曬係數，所以後來就送人了但我覺得如果不在意有沒有防曬功能的人倒是可以考慮這款"""
這是好幾年前買的，沒有留下產品照當時特價只要99塊所以就入手我買的色號是02粉陶色他的外觀非常輕巧可愛，很適合方便攜帶但是粉撲沒辦法放進粉餅盒裡，失去了方便攜帶的意義粉撲的材質不綿密，也沒有彈性粉筆本身壓的不實，容易飛粉粉餅分成兩部分，粉底跟打亮，滿實用的粉底控油效果還可以，沒有卡粉情形沒什麼遮瑕度，所以不適合當底妝，較適合用來補妝打亮的亮粉顆粒滿大的不會回購,色號是02粉陶色他的外觀非常輕巧可愛
今天分享的是1028新推出的控油柔焦氣墊粉餅 SPF23 PA++我覺得這款氣墊粉餅的包裝很可愛，超像馬卡龍的，拿起來很輕，是我目前最輕的氣墊粉餅耶所以也是我出外攜帶第一個考慮的我是混合偏乾的膚質，夏天要到了 T字容易出油~我本來在想這款控油的妝效會不會很霧面、我的臉頰會不會很乾(因為我以前用控油的粉底液會有這樣的問題)?結果完全不會!!它的妝效是我喜歡的????剛使用的時候就像裸妝，感覺是介在霧面和光澤之間，我看包裝寫也有添加保濕的成分，所以不會乾乾的哦?在毛孔的地方多輕拍幾下，也有一點遮蓋的效果??我是選#01明亮膚，我是自然膚色的女孩，我使用這款在臉部中央，較外圍的地方我都沒有沾，就是自然的推開，可以直接用氣墊粉餅製造出小臉打亮效果唷~~~氣色看起來也很好而且還有防曬係數～～～挺方便的！！???最厲害的是，我沒有用蜜粉直接出門，10小時之後，只有鼻頭輕微泛一點油光，不是那種很可怕的脫妝膚色也沒有因為時間一久而黯沉??覺得是高ｃｐ值的產品~當然還是要以自己的膚質挑選適合的唷,是1028新推出的控油柔焦氣墊粉餅 SPF23 PA++我覺得這款氣墊粉餅的包裝很可愛，效果我是選#01明亮膚，我是自然膚色的女孩，我使用這款在臉部中央，較外圍的地方我都沒有沾，就是自然的推開，可以直接用氣墊粉餅製造出小臉打亮效果唷氣色看起來也很好而且還有防曬係數～～～挺方便的！
<彩妝。修飾>1028 持光修片餅，讓妳快速定妝X柔焦，隨時保持自然透亮光澤肌~*1028家的產品，一直都是Judy喜愛入手的開架品牌之一因為產品就是好用又令人超愛用啦?今天Judy來介紹一款以簡單輕壓輕拍就能擁有自然光感的快速定妝+柔焦神器~?就是它。1028 持光修片餅~*?經典的黑色外盒包裝~~Judy每每只要看到黑色的相關包裝，就會莫名感到就是個質感超優的產品所以拿到1028持光修片餅更是有飛揚的心情~(笑)?1028 持光修片餅/480元。一打開….修片餅設計分為上下兩層，上層為修片餅以及鏡子，下層就是專用的修片粉撲喔~~?看看修片餅的質地，呈現粉白色的微霜狀質地，它不是一般的蜜粉狀或粉餅質地喔~~是帶有點綿密紮實的濕潤細緻粉餅質地，粉末實在是細緻，完全不會乾燥喔。?另外特別要來介紹一下這個好特別的專用QQ粉撲它跟一般我們所使用的傳統粉撲完全不同，是QQ又柔軟的質地。?Judy使用時需要像這樣...稍稍施點力來沾取滴^^是偏帶點滋潤感的淡淡的粉白色調粉末。?看看它這樣小巧又精美的外盒，隨身攜帶補妝就是便利啦~~?Judy打好淡妝感的底妝之後，使用專用QQ粉撲沾取適量修片餅~?就這樣輕拍於臉部局部肌膚它整個的服貼度相當不錯，使用時若有似無的輕盈感覺….還令Judy想說有?!還是無?!一看…..來來來!!!先看半邊臉?肌膚光澤感及透亮感都UPUP提升嚕~~?而且而且~~~~它可以定妝，但膚質質地不會感覺乾燥或像一般使用蜜粉定妝般的霧面感?這款1028 持光修片餅它所呈現出的是可以定妝外，又呈現較為透亮又自然的柔焦美肌感啦。也就是同時具備可定妝X有光澤感X又保有氣墊粉餅的透亮感捏!!?它這樣小小一個，方便攜帶外出~像Judy平常都隨身攜帶靠它來補妝，隨時啟動最佳美肌模式(竊笑)這款1028 持光修片餅，能快速擁有自然透亮光澤肌，真的非常實用。女孩兒快手刀衝刺阿!!,產品，使用的傳統粉撲完全不同，是QQ又柔軟的質地。
