review_content,simplified_review
"看到版上很多對於這瓶粉底精華的反推聲浪之後，激起了我熊熊的好奇心在小區試在手背上的時候他真的卡粉了，卡到我都看的到自己手背的紋路他們家的CC霜真的還蠻好用的啊，怎麼出了個粉底精華變成這樣所以我就借了姊妹買的正貨連續用了一個多星期我覺得其實也沒那麼糟糕啊....我用在臉上之後反而對他改觀有點想要去買正貨了(前提是如果他降價的話XD) 還是先傷大家眼睛一下，來一張只有眼妝可是沒有底妝的照片我本身是油性粉刺肌，臉上很多一粒一粒的粉刺跟痘疤臉頰的毛孔也很明顯這瓶給我一開始的印象就是他很乾...跟我想像中的粉底精華很保濕的感覺完全不一樣顏色的話我覺得稍微偏白，不過因為我本來就習慣買比我的膚色白一個色號的粉底液所以還算可以接受 所以在種種的考量因素下我找到了一個我覺得用起來效果最好的方法---跟banila co.的prime primer混合使用，這瓶primer有妝前控油的效果之前買了之後覺得驚為天人，我很多太乾的粉底液都是靠他來挽救的!!!!雖然主打的是控油效果，可是跟乾乾的粉底液混合在一起反而會讓底妝變順變服貼而且控油力上升之後持妝度也大大變好!!!只可惜這瓶在台灣買不到比例大致上是1:1/2 ，我後來發現粉底精華會卡粉的最大因素很像是我用太多了我後來都用很少很少的量然後混合妝前乳，這樣呈現出來的妝感會很薄透而且不卡粉 混合好的粉底精華均勻的點在臉上，然後很輕鬆的就可以用指腹推開（沒有混合妝前的粉底精華真的很乾...完全推不均勻）推開之後再用海綿輕輕按壓，把一些多餘或是不均勻的地方處理好 上完妝的樣子，我覺得毛孔很不明顯，而且整體來說還蠻順的，是比較粉霧感的底妝痘疤粉刺的部份就要自己在額外的加強遮暇了 然後這瓶最讓我的油性肌滿意的地方就是持妝力我用banila co的妝前跟很多的粉底液都混合過，跟這瓶粉底精華混合的持妝力真的是我目前用過最好的左圖是早上八點多我剛上完粉底精華的樣子，右圖是上了蜜粉之後晚上九點多直接拍的樣子幾乎沒有什麼暗沉掉妝的現象!!! 而且臉上有一點油光很像還更好看了點最後小小總結一下個人心得：**我其實也不懂為什麼這瓶要叫做""粉底精華""""，因為他的質地真的偏乾，保濕度硬要比的話也是非常普通，乾性肌膚的人用了應該會受不了**我覺得優點：持妝力好/不暗沉/妝感服貼/遮暇力還不錯     缺點：質地過乾需要找個好妝前來拯救他/定價偏高/乾性肌膚較不適合使用**卡粉的問題只有第一次我在用粉底刷上妝的時候碰到，我建議如果對於粉底刷操控度跟我一樣不太好的人還是參考我的懶人上妝法吧XD用手跟海綿就可以輕鬆解決了，用量少少的讓他薄薄一層在臉上我覺得呈現出來的感覺最好而且不會卡粉搭配好的妝前對這瓶來說真的很重要，不然我應該用不下去（笑）以上跟大家分享我的心得，謝謝收看:)完整版原文：http://a22215714.pixnet.net/blog/post/41565739""","看到版上很多對於這瓶粉底精華的反推聲浪之後，激起了我熊熊的好奇心在小區試在手背上的時候他真的卡粉了，卡到我都看的到自己手背的紋路他們家的CC霜真的還蠻好用的啊，怎麼出了個粉底精華變成這樣所以我就借了姊妹買的正貨連續用了一個多星期我覺得其實也沒那麼糟糕啊....我用在臉上之後反而對他改觀有點想要去買正貨了(前提是如果他降價的話XD) 還是先傷大家眼睛一下，來一張只有眼妝可是沒有底妝的照片我本身是油性粉刺肌，臉上很多一粒一粒的粉刺跟痘疤臉頰的毛孔也很明顯這瓶給我一開始的印象就是他很乾...跟我想像中的粉底精華很保濕的感覺完全不一樣顏色的話我覺得稍微偏白，不過因為我本來就習慣買比我的膚色白一個色號的粉底液所以還算可以接受 所以在種種的考量因素下我找到了一個我覺得用起來效果最好的方法---跟banila co.的prime primer混合使用，這瓶primer有妝前控油的效果之前買了之後覺得驚為天人，我很多太乾的粉底液都是靠他來挽救的!!!!雖然主打的是控油效果，可是跟乾乾的粉底液混合在一起反而會讓底妝變順變服貼而且控油力上升之後持妝度也大大變好!!!只可惜這瓶在台灣買不到比例大致上是1:1/2 ，我後來發現粉底精華會卡粉的最大因素很像是我用太多了我後來都用很少很少的量然後混合妝前乳，這樣呈現出來的妝感會很薄透而且不卡粉 混合好的粉底精華均勻的點在臉上，然後很輕鬆的就可以用指腹推開（沒有混合妝前的粉底精華真的很乾...完全推不均勻）推開之後再用海綿輕輕按壓，把一些多餘或是不均勻的地方處理好 上完妝的樣子，我覺得毛孔很不明顯，而且整體來說還蠻順的，是比較粉霧感的底妝痘疤粉刺的部份就要自己在額外的加強遮暇了 然後這瓶最讓我的油性肌滿意的地方就是持妝力我用banila co的妝前跟很多的粉底液都混合過，跟這瓶粉底精華混合的持妝力真的是我目前用過最好的左圖是早上八點多我剛上完粉底精華的樣子，右圖是上了蜜粉之後晚上九點多直接拍的樣子幾乎沒有什麼暗沉掉妝的現象!!! 而且臉上有一點油光很像還更好看了點最後小小總結一下個人心得：**我其實也不懂為什麼這瓶要叫做""粉底精華""""，因為他的質地真的偏乾，保濕度硬要比的話也是非常普通，乾性肌膚的人用了應該會受不了**我覺得優點：持妝力好/不暗沉/妝感服貼/遮暇力還不錯     缺點：質地過乾需要找個好妝前來拯救他/定價偏高/乾性肌膚較不適合使用**卡粉的問題只有第一次我在用粉底刷上妝的時候碰到，我建議如果對於粉底刷操控度跟我一樣不太好的人還是參考我的懶人上妝法吧XD用手跟海綿就可以輕鬆解決了，用量少少的讓他薄薄一層在臉上我覺得呈現出來的感覺最好而且不會卡粉搭配好的妝前對這瓶來說真的很重要，不然我應該用不下去（笑）以上跟大家分享我的心得，謝謝收看:)完整版原文：http://a22215714.pixnet.net/blog/post/41565739"""
這瓶的包裝很有質感 看起來很像比較高級的~~我是看電視小凱老師推薦因為1028的CC霜和粉凝霜 都很好用想說這個應該不會失望-.-這款有點難推 質地有點硬不適合我 不會回購,包裝很有質感 看起來很像比較高級的我是看電視小凱老師推薦因為1028的CC霜和粉凝霜 都很好用想說這個應該不會失望-.-這款有點難推 質地有點硬不適合我 不會回購
嗯..這款 外觀看起來高級..使用方式也很新奇..以開架粉底來說價錢也不便宜的粉底液實在是有點難用啊T_T上妝算是滿好塗勻的但是只要你臉上有一點點小脫皮.....就算是原本素顏也完全看不出來的脫皮一塗上粉底，絕對卡一大塊在上面!!!本來沒上都還好，一塗整個大現型啊，好可怕!!!所以都要另外跳過脫皮的地方..另外遮瑕方面也實在很薄弱......完全是沒什麼感覺啊頂多就是讓皮膚比素顏好一點點而已所以....很努力在使用這罐(因為很貴..趕快用完就可以買別款了..(逃,粉底液實在是有點難用啊T_T上妝算是滿好塗勻的但是只要你臉上有一點點小脫皮就算是原本素顏也完全看不出來的脫皮一塗上粉底
這瓶號稱是精華型粉底，使用前須上下搖勻產品包裝是滴管型設計、取用很方便不用怕會不小心失手用太多、也不需要徒手挖染污整瓶粉底產品質地很水潤，一不小心滴太多會在臉上很快流動臉頰部分用手就可以很容易推勻不過鼻翼兩側容易卡粉最後用海綿按壓完妝後很自然、薄透是屬於裸妝感、給人比較像粉霧型的妝感但毛孔遮瑕力不高、兩頰的毛孔大約只能遮住50%控油效果也很普通在冷氣房裡戴口罩工作，大約2小時候就開始出油脫妝慶幸的是脫妝後感覺還算自然、不會給人底妝完全斑駁的感覺整體來說算得上是70分的商品,妝感但毛孔遮瑕力不高、兩頰的毛孔大約只能遮住50%控油效果也很普通在冷氣房裡戴口罩工作
它不是號稱精華粉底嗎?而且很多部落格推薦這款粉底液耶但是 怎麼那麼難用......本來在奇摩購物中心看到一整組有特價有CC霜 粉底液 跟粉餅 真的很心動剛好前幾天看到小屈有賣 也有擺試用品本來很衝動要買 不過沒有我的色號 它只有02的色號我就放棄在小屈購買了後來胡蝶跟我說叫我素顏去小屈試用 再決定我今天就跑去小屈試用 想說色號不對也沒關係 只是試用質地真是好險 好險我沒買 超級難用 不然我的500多塊就飛了試在手上的時候就有點卡粉後來直接試在臉上真的是非常非常的乾乾乾......而且會卡粉 不好推我才上妝兩小時妝就脫的很誇張 整個大浮粉它不是精華粉底嗎 應該很保濕ㄚ 怎麼會這樣@@重點是 還會暗沉== 我很少用到粉底會暗沉的耶 這很誇張水水們要買建議先去小屈試用看看再決定千萬不要看了部落格的推薦就買......不然下場就是傷錢又傷肌膚!!!,很心動剛好前幾天看到小屈有賣 也有擺試用品本來很衝動要買 不過沒有我的色號 它只有02的色號我就放棄在小屈購買了後來胡蝶跟我說叫我素顏去小屈試用 再決定我今天就跑去小屈試用 想說色號不對也沒關係 只是試用質地真是好險 好險我沒買 超級難用 不然我的500多塊就飛了試在手上的時候就有點卡粉後來直接試在臉上真的是非常非常的乾乾乾而且會卡粉 不好推我才上妝兩小時妝就脫的很誇張 整個大浮粉它不是精華粉底嗎 應該很保濕ㄚ 怎麼會這樣重點是 還會暗沉== 我很少用到粉底會暗沉的耶 這很誇張水水們要買建議先去小屈試用看看再決定千萬不要看了部落格的推薦就買不然下場就是傷錢又傷肌膚
除了油肌外我都會跟我朋友大推這瓶，因為我本身是油肌，很油的那種，無論春下秋冬，本來沒擦痘痘藥的時候上這個粉底不誇張大概只維持了兩個小時，後來擦了痘痘藥後皮膚就沒這麼油了，持妝力可以到傍晚，換了這瓶連班上的男同學都覺得我變漂亮了，我覺得是因為他呈現出來的真的就是個很自然很裸肌的感覺，皮膚黑擦上去也會覺得好像是本來就是這麼白，所以我都會推薦這瓶給不是油肌的朋友，我本身自己是搭配他們家的粉底刷，我個人是覺得滿好搭配的^_^,除了油肌外我都會跟我朋友大推這瓶，因為我本身是油肌，很油的那種，無論春下秋冬，本來沒擦痘痘藥的時候上這個粉底不誇張大概只維持了兩個小時，後來擦了痘痘藥後皮膚就沒這麼油了，持妝力可以到傍晚，換了這瓶連班上的男同學都覺得我變漂亮了，我覺得是因為他呈現出來的真的就是個很自然很裸肌的感覺，皮膚黑擦上去也會覺得好像是本來就是這麼白，所以我都會推薦這瓶給不是油肌的朋友，我本身自己是搭配他們家的粉底刷，我個人是覺得滿好搭配的^_^
完全不親膚推了五分鐘還是有粉痕最後是用海綿點才勉強合膚但幾個小時候就整臉浮出來用量很省是唯一的優點總之不親膚根本沒辦法用遮瑕跟保濕也普通對我來說是大地雷價格不可愛又無法用真的很傻眼,優點總之不親膚根本沒辦法用遮瑕跟保濕也普通對我來說是大地雷價格不可愛又無法用真的很傻眼
附上官網介紹商品特色，高防曬，輕涼感，潤舒緩高效防護力，全面防禦UVA、UVB水感微涼薄荷，好推清爽不悶熱無添加酒精、香料、Paraben，溫和防曬不傷肌容量：40ml使用感受，藥妝店購入，40ml，百元有找，非常划算，無意看到在架上，就購入試試。乳白色，乳液質地，薄透不厚重，輕盈乳液。夏天使用還不錯，擦上臉是涼感的，會降溫，還帶有點檸檬味，我很喜歡的味道。推勻感覺浮浮的，質地不是很密，不過也還算順利推勻吸收進去膚色之中，純粹防曬效果，沒有什麼潤色提亮等等功能。有些涼感的防曬產品我會覺得不適，或是刺激，這款目前使用幾次還行，就是涼涼的感受而已。缺點大概就是比較水感，流汗也容易流掉，要常補擦比較保險。便宜使用起來也不心疼，夏天防曬用量比較兇，給大家參考囉。,味道，效果，沒有什麼潤色提亮等等功能。，使用感受，藥妝店購入，40ml，百元有找，非常划算，無意看到在架上，就購入試試。
於網路平台購入。常有買一送一的活動。正品容量為30g。防曬係數為SPF50+，防曬力相當足夠。包裝風格相當簡約。採用立可白式的設計，使用前須先搖晃均勻。瓶口大小適中，很好控制使用量。抗曬乳為白色乳狀，帶有明顯的花香味。質地水感，流動性佳，在臉上很好推開，觸感相當滑順，非常特別。屬於透明防曬，沒有潤色效果，很適合當作妝前打底。使用時不泛白、不咬手，有防汗效果。滋潤度蠻高的，剛擦上去時，會覺得有點油、小悶，臉部會泛油光；等待成膜之後，肌膚就會變得乾爽、舒適。當作臉部防曬，秋冬時使用蠻剛好的；若是怕油膩的人，夏季使用，建議當成身體防曬。,活動，效果，很適合當作妝前打底。，使用前須先搖晃均勻。
1028 【超能曬水感防曬乳】我真的遍尋不著這個品項只好寫在相似的 水感防曬乳當中SPF50+ PA++++水感輕盈，清爽不泛白，溫和零負擔全面抵抗UVB+UVA全波段，防止曬黑曬傷擦起來確實是水乳液質地清爽好吸收不黏膩、無負擔本身沒顏色適合當作妝前隔離使用,遍尋不著這個品項只好寫在相似的 水感防曬乳當中SPF50+ PA++++水感輕盈
其實我很少再擦身體防曬...因為我都全身包得緊緊的~~但為了健康想說還是曬點太陽...所以最近開始擦身體防曬...加減曬一下太陽~~吸收維他命D...這款我已空空賞~~意外的我還滿喜歡的~~用起來會有涼感~~很適合夏天~~是乳液狀~~不厚重也不黏膩!!推開以後很好吸收~~也很輕透~~我都拿它來身體防曬..沒有擦臉~~但我覺得防曬效果還可以~~我帶小孩去海邊...在陰涼處..偶而曬到太陽...大概1個小時...身體沒有曬黑~~就算有擦防曬我也不會大太陽底下曬>~<因為身體本來就沒有臉白~~在曬下去怕整個人長得很奇怪????????????總之~~這個防曬滿好用的~~不黏膩...清爽~~價格也可以接受~~CP值滿高的..推薦給大家~~~謝謝大家收看超不專業心得分享(???`?)(???`?)(???`?)(???`?),其實我很少再擦身體防曬...因為我都全身包得緊緊的~~但為了健康想說還是曬點太陽...所以最近開始擦身體防曬...加減曬一下太陽~~吸收維他命D...這款我已空空賞~~意外的我還滿喜歡的~~用起來會有涼感~~很適合夏天~~是乳液狀~~不厚重也不黏膩!!推開以後很好吸收~~也很輕透~~我都拿它來身體防曬..沒有擦臉~~但我覺得防曬效果還可以~~我帶小孩去海邊...在陰涼處..偶而曬到太陽...大概1個小時...身體沒有曬黑~~就算有擦防曬我也不會大太陽底下曬>~<因為身體本來就沒有臉白~~在曬下去怕整個人長得很奇怪????????????總之~~這個防曬滿好用的~~不黏膩...清爽~~價格也可以接受~~CP值滿高的..推薦給大家~~~謝謝大家收看超不專業心得分享(???`?)(???`?)(???`?)(???`?)
去年夏天因為特價的關係我買了很多瓶1028的 輕一夏。防曬噴霧一個原因是我懶我想要用噴的比較方便比較快再加上SPF50+/PA+++系數很高很適合機車族而且，我夏天都要用很多瓶防曬所以就買來囤了目前手邊用剩下一瓶這樣來分享心得應該還蠻資深的吧！因為我一次買很多瓶所以有發現每瓶的重量感覺有一些差別不知道是我自己的手感還是真的是品管的問題他有一個最大的優點是可以倒著噴這對使用的人來說很方便不用糾結著一定要正正的拿但目前好像很多都可以了介紹有說乾濕都可以用但我都是乾噴還沒有身體是濕的使用過所以不知道效果至於臉、身體、頭髮都可使用這點我沒有噴頭髮防曬的習慣，這項跳過臉和身體我都有噴過身體一定是ＯＫ的但噴臉時記得要閉上眼睛不然會很危險可我還是不喜歡臉用噴的因為用噴的防曬的是油的質地用在身體還不感覺太油膩感但在臉上油油的感覺不好所以我後來都是身體用噴的但臉擦比較清爽的防曬乳還有使用上建議大家用噴的要小範圍而且動作要快不然還蠻快乾的但缺點就是你不知道哪噴過了，哪沒有噴因為看不出來啊！至於，防曬乳大家最期待的效果就是不曬黑啊！但看我的手就知道我不白，但我又是個熱愛美白的人再加上是機車族所以，四季我都蠻認真的擦防曬但我本身就不是白底所以，擦了也沒有明顯的不曬黑但是，長時間在戶外的話，是不會曬到曬傷啦！只是還是會攦得很紅再轉黑而防曬噴霧我覺得最大的問題是在他的味道基本上都很臭很化學我有用過更臭的覺得這個算是一般臭建議擔心這點的人可以先去７＊４試噴看看再下手吧！,關係我買了很多瓶1028的 輕一夏，效果至於臉、身體、頭髮都可使用這點我沒有噴頭髮防曬的習慣，這項跳過臉和身體我都有噴過身體一定是ＯＫ的但噴臉時記得要閉上眼睛不然會很危險可我還是不喜歡臉用噴的因為用噴的防曬的是油的質地用在身體還不感覺太油膩感但在臉上油油的感覺不好所以我後來都是身體用噴的但臉擦比較清爽的防曬乳還有使用上建議大家用噴的要小範圍而且動作要快不然還蠻快乾的但缺點就是你不知道哪噴過了，哪沒有噴因為看不出來啊！
之前在寶雅試用過這款1028水護罩輕感抗曬乳 SPF50+★★★★ 覺得清爽度很高、有涼感不太黏 ，後來官方??有買一送一優惠2條350元 就買了另外它?沒有加香精、酒精、paraben先來看官方介紹（圖片來源自官網）??以布列塔尼海洋水為基底??富含B3、洋甘菊、南美樹香葉、西葫蘆籽舒緩植萃-修護曬後肌膚??玻尿酸、蘆薈保濕因子-補水、抗乾燥容量40ml顏色是淡淡的檸檬綠看得出一推開就呈現水感成分中添加薄荷 擦起來頗有涼感擦起來透明無色、透薄服貼防水測試ok 耐汗程度因為透明的 看不太出來是否耐汗??清涼感在夏天使用很舒服不黏膩這點有加分如果要搭配底妝使用因為它的水感度高建議可以稍微等它乾一點再上後續的底妝可以減低不好上妝的問題,檸檬綠看得出一推開就呈現水感成分中添加薄荷 擦起來頗有涼感擦起來透明無色、透薄服貼防水測試ok 耐汗程度因為透明的 看不太出來是否耐汗清涼感在夏天使用很舒服不黏膩這點有加分如果要搭配底妝使用因為它的水感度高建議可以稍微等它乾一點再上後續的底妝可以減低不好上妝的問題
