review_content,simplified_review
"當初會買這塊1028的粉餅是因為要去小琉球玩, 超怕在烈日下曬黑而這粉餅SPF50+++令人相當放心補妝的時候也能補防曬:)個人膚質是混和性, 鼻頭易出油膚色一般偏白(但出油後易暗沉)買了色號01淺陶色實際使用:保濕後→sofina隔離乳→遮瑕→1028傅明酸亮透美白粉餅對它頗滿意的!原因如下：1. 粉質很細!很薄透!使用在臉上不會覺得有負擔也可以放心的補妝, 因為不會結塊在小琉球我用這個補臉上的防曬, 妝感也沒有因此變得更厚重2. 持久度也不錯我大約早上8:30拍粉餅到了中午, 膚色還是明亮的!這我真的超感動, 因為我自己很容易暗沉它竟然可以幫助我度過整個上午的炎熱中午補拍一次粉餅,下午氣色看起來維持不錯3. SPF50果然有發揮效用,去小琉球完沒有曬黑而且前面也有提過, 因為粉質清透, 所以可以放心的用它補防曬4. 謝天謝地不致過敏原本想給他七顆星但改為六顆原因也細分如下1. 遮瑕效果普普因為薄透的關係吧！感覺較適合膚況不差的時候2. 它可以提升整體明亮度沒錯但我比較希望有粉嫩膚質的感覺之前用過ZA蜜粉餅拍起來膚色比較「粉嫩」1028這個感覺只有「白皙」雖然有上面兩個小瑕疵(其實說不定是我自己太吹毛求疵XD)但因為它有前述那些優點, 所以我心裡還是覺得它很優以後夏天還是會回購歐!ps(1)黑眼圈方面要另外靠遮瑕膏因為我黑眼圈真的太嚴重了XDps(2)在小琉球的晚上我會敷廣源涼蘆薈(曬後用)說不定因此隔天膚況不錯,跟粉餅就更match","粉餅是因為要去小琉球玩, 超怕在烈日下曬黑而這粉餅SPF50+++令人相當放心補妝的時候也能補防曬:)個人膚質是混和性, 鼻頭易出油膚色一般偏白買了色號01淺陶色實際使用:保濕後→sofina隔離乳→遮瑕→1028傅明酸亮透美白粉餅對它頗滿意的!原因如下：1. 粉質很細!很薄透!使用在臉上不會覺得有負擔也可以放心的補妝, 因為不會結塊在小琉球我用這個補臉上的防曬, 妝感也沒有因此變得更厚重2. 持久度也不錯我大約早上8:30拍粉餅到了中午, 膚色還是明亮的!這我真的超感動, 因為我自己很容易暗沉它竟然可以幫助我度過整個上午的炎熱中午補拍一次粉餅,下午氣色看起來維持不錯3. SPF50果然有發揮效用,去小琉球完沒有曬黑而且前面也有提過, 因為粉質清透, 所以可以放心的用它補防曬4. 謝天謝地不致過敏原本想給他七顆星但改為六顆原因也細分如下1. 遮瑕效果普普因為薄透的關係吧！感覺較適合膚況不差的時候2. 它可以提升整體明亮度沒錯但我比較希望有粉嫩膚質的感覺之前用過ZA蜜粉餅拍起來膚色比較「粉嫩」1028這個感覺只有「白皙」雖然有上面兩個小瑕疵但因為它有前述那些優點, 所以我心裡還是覺得它很優以後夏天還是會回購歐!ps黑眼圈方面要另外靠遮瑕膏因為我黑眼圈真的太嚴重了XDps在小琉球的晚上我會敷廣源涼蘆薈說不定因此隔天膚況不錯,跟粉餅就更match，效果普普因為薄透的關係吧！"
"在urcosme找粉餅時看到這款粉餅在前幾名...因為價錢很便宜所以很好奇的點了進去網友一致好評也驅使我去找了找其他美妝部落客的使用文章老實說我不是很相信他們啦-_- 很多產品明明超難用卻說的多好用 (但還不是去找了哈哈)但連這邊的網友們都說好用...那就一定是真的好用啦~我是第一次使用1028的產品之前一直很想買來用看看　但他家的產品對我都不夠生火這次因為看到限量粉盒好可愛導致我敗了下去我在購物中心入手的　$300　包含粉餅+粉撲+粉盒　感覺就很划算阿 >,<我要買時也只剩下搭配藍色粉盒的02和03號色　其他都賣光囉但剛好我也是想挑選藍色粉盒　好幸運看了很多網友的心得　決定挑選02號色怕03太深　雖然我皮膚也不白且偏黃　但之前粉餅都不會挑到太深　都在中間色剛好購入的隔天就去遊樂園玩然後我當天是搭配雅詩蘭黛的粉底當天天氣太陽不會很大　但因為都有在走動而且風也不大　所以也不算是很涼的天氣身體開始流汗的時候就在想說妝會不會被毀掉...可是照了一下鏡子感覺還好到了下午要補妝時　發現他的粉質真的好細緻!細緻到你補妝不會過度霧面或是不好補妝也不卡粉　補完就是真的跟剛完妝一樣的感覺我之前用粉餅補妝都一定會稍微脫妝　屢試不爽然後這款粉餅的持妝效果我是覺得一般鼻子出油時間大約也是3~4小時過後 (我有搭配sofina零油光)可是並不會出油的太誇張　且出油不會造成誇張的斑駁　應該是說完全不會斑駁~不過這款粉餅遮瑕力幾乎是0　會介意的人就要注意囉且這款剛上妝時的妝容也是不會太過霧面　老實說這樣我好喜歡因為太霧面看起來妝感很重　但這款完全不會　也不怕失手上太多造成很假面人的感覺我當天共補了兩三次妝　完全都不會卡粉!!!　my god 超級無敵開心~~~這麼便宜的粉餅卻有如此驚豔的效果你說　能不買嗎?　超級無敵推薦的一款粉餅啦^_^","點了進去網友一致好評也驅使我去找了找其他美妝部落客的使用文章老實說我不是很相信他們啦-_- 很多產品明明超難用卻說的多好用 但連這邊的網友們都說好用那就一定是真的好用啦~我是第一次使用1028的產品之前一直很想買來用看看　但他家的產品對我都不夠生火這次因為看到限量粉盒好可愛導致我敗了下去我在購物中心入手的　$300　包含粉餅+粉撲+粉盒　感覺就很划算阿 >,<我要買時也只剩下搭配藍色粉盒的02和03號色　其他都賣光囉但剛好我也是想挑選藍色粉盒　好幸運看了很多網友的心得　決定挑選02號色怕03太深　雖然我皮膚也不白且偏黃　但之前粉餅都不會挑到太深　都在中間色剛好購入的隔天就去遊樂園玩然後我當天是搭配雅詩蘭黛的粉底當天天氣太陽不會很大　但因為都有在走動而且風也不大　所以也不算是很涼的天氣身體開始流汗的時候就在想說妝會不會被毀掉可是照了一下鏡子感覺還好到了下午要補妝時　發現他的粉質真的好細緻!細緻到你補妝不會過度霧面或是不好補妝也不卡粉　補完就是真的跟剛完妝一樣的感覺我之前用粉餅補妝都一定會稍微脫妝　屢試不爽然後這款粉餅的持妝效果我是覺得一般鼻子出油時間大約也是3~4小時過後 可是並不會出油的太誇張　且出油不會造成誇張的斑駁　應該是說完全不會斑駁~不過這款粉餅遮瑕力幾乎是0　會介意的人就要注意囉且這款剛上妝時的妝容也是不會太過霧面　老實說這樣我好喜歡因為太霧面看起來妝感很重　但這款完全不會　也不怕失手上太多造成很假面人的感覺我當天共補了兩三次妝　完全都不會卡粉　my god 超級無敵開心這麼便宜的粉餅卻有如此驚豔的效果你說　能不買嗎?　超級無敵推薦的一款粉餅啦^_^"
被網友心得燒到不行，剛好最近很失心瘋的購買各家粉餅，開架、專櫃都有，剛好在奇摩購物看到粉餅+限量版粉盒+隔離乳的組合，一組499元，就入手了。粉餅在選色時有點難倒我了，因為沒看過實品，網頁上直接看色號又有點不準，目前膚色是健康偏白，希望上完粉餅的氣色看起來是好的，所以選了粉陶(02)，粉盒也是抉擇了一下，選了比較符合自己個性的藍色，後來看到粉紅的分享也覺得頗好看的，啊~~~~~收到沒多久就開來使用囉!粉質真的沒話說，有夠細的，對毛孔有一定的修飾效果，加上我是個會瘋狂流汗，而且汗都集中在臉部跟脖子的人，之前用其他粉餅或蜜粉，上妝完很ok，流汗到一個程度沒有立刻擦掉，臉上就會開始有粉痕，冏~~而且會卡粉在毛孔裡，但這款完全不會有這種狀況，就連擦汗的時候，沾染到手帕上的粉量也不會到很誇張，我是不怎麼期待粉餅的美白效果啦!但有SPF50+的防曬係數，讓出門在外無法補防曬，只能補粉餅的我很安心呢!(雖然通常是沒有在補啦!)色號的部份，粉陶可以說完全是跟我膚色一致的顏色，所以沒有任何的明亮效果，因此，我又入手了淺陶01，用過之後再來更新囉!兩色也可以拿來混用打造立體妝，嘿嘿!,被網友心得燒到不行，剛好最近很失心瘋的購買各家粉餅，開架、專櫃都有，剛好在奇摩購物看到粉餅+限量版粉盒+隔離乳的組合，一組499元，就入手了。粉餅在選色時有點難倒我了，因為沒看過實品，網頁上直接看色號又有點不準，目前膚色是健康偏白，希望上完粉餅的氣色看起來是好的，所以選了粉陶(02)，粉盒也是抉擇了一下，選了比較符合自己個性的藍色，後來看到粉紅的分享也覺得頗好看的，啊~~~~~收到沒多久就開來使用囉!粉質真的沒話說，有夠細的，對毛孔有一定的修飾效果，加上我是個會瘋狂流汗，而且汗都集中在臉部跟脖子的人，之前用其他粉餅或蜜粉，上妝完很ok，流汗到一個程度沒有立刻擦掉，臉上就會開始有粉痕，冏~~而且會卡粉在毛孔裡，但這款完全不會有這種狀況，就連擦汗的時候，沾染到手帕上的粉量也不會到很誇張，我是不怎麼期待粉餅的美白效果啦!但有SPF50+的防曬係數，讓出門在外無法補防曬，只能補粉餅的我很安心呢!(雖然通常是沒有在補啦!)色號的部份，粉陶可以說完全是跟我膚色一致的顏色，所以沒有任何的明亮效果，因此，我又入手了淺陶01，用過之後再來更新囉!兩色也可以拿來混用打造立體妝，嘿嘿!
"我是自然偏白，有黑色素沉澱痘疤，毛孔不明顯，混合性膚質。摸過實品後，覺得1號跟2號差別不大，但是2號偏紅感，由於不喜歡偏紅色的臉，怕買回去之後不合適，最後選了1號白皙色。最近常常使用這塊粉餅~一來是夏天太陽很大，這塊粉餅的防曬係數讓我安心。(spf50+++)二來是因為她的粉質細緻，按壓在臉上很貼，上第二層也不會厚粉或斑駁。她的功能上寫說可以美白,淡化斑點，但這些我感受不到><粉質因為很細，用蜜粉刷的話會飛粉，有點小小浪費的感覺。遮蓋毛孔的功力也不錯，但我的毛孔不是很大的那種，上完是霧面柔焦感，等一陣子後出油了會更加漂亮!我很喜歡她修飾完膚色的感覺，氣色很好，現在大熱天的一出門一定爆汗，但我發現，他並不會讓妝斑駁，反而有點奶油肌的感覺，用面紙按壓掉汗水油脂後，又看起來OK了。另外，我用他不會暗沉喔!!!本身是容易長痘痘的肌膚，也沒有致痘的感覺唷~算是一個價格合理又好用的產品，我也有推薦給我同學~",臉，使用這塊粉餅~一來是夏天太陽很大，這塊粉餅的防曬係數讓我安心。
一直對1028的產品很感興趣....但是之前的底妝品評價有點兩極，導致我不敢出手啊~直到這塊保濕雙采粉餅......大概有打亮格的粉餅都會很吸引我吧！如果粉底液有設計成兩管式(一管粉底一管打亮)也會很勸我敗.....網拍買比較便宜喔(小聲說)！拿到實品後超開心~很大方的全黑設計啊！粉質算細，色調也不會太白(我選粉陶色)，但是粉撲有點小遺憾.....不是我喜歡的彈性和軟度，自己覺得有一點小難用....妝感很透！超透！粉感好低啊~~所以剛上完妝你不會有麵粉臉的感覺，而且還會想一直去撲粉....因為好像都沒有撲上去的感覺......可能也是因為強調保濕，它，不控油，我在冷氣房下到中午鼻頭就會有點小糊妝了，不過補一補還是會回到不錯的狀態。很多網友說它其實就直接當蜜粉餅就好.....定妝>當底妝，這陣子我越用也越覺得如此，尤其和打亮格混合刷上臉，真的很透又不厚粉；又因為透，所以不遮瑕啊~冰U啊~要做好每天要花時間遮瑕的準備才可以下手這款啊！否則會很想摔粉餅(誤)。不然說實在的打亮格蠻美的......是不比舊款的萊雅三色光譜美啦(亮片比較大)，但還算不錯囉~所以咧~我不太推薦給油肌和高瑕疵肌，夏天也不太推薦用它在大太陽下趴趴造，雖然剛完妝的透亮感和出油後的光澤感很討人喜歡....但是也要承受大糊妝的下場啊！還有啊，因為太透了，所以上在臉上根本不會有過白的情況發生......這感覺就好像chacott晶透白那色整臉撲的感覺吧......sofina ange的優點就完全體現出來了......雖然粉感重妝感重但可以在炎熱氣候下撐很久。以上純屬個人心得，僅供參考,產品很感興趣但是之前的底妝品評價有點兩極
0507修改降為3-4顆心對我來說有致痘的嚴重可能!!!那幾天保養一樣!! 底妝只有乾擦它結果 用一兩禮拜 發現它 讓我左半臉開始大冒痘!!!也不是那個要來 就是很平穩的時間竟然給我冒痘!!!!這款打入冷宮!!!!!!!!這款粉質非常細甚至比我的小香還細(10倍的價格?)這款跟布朗尼眼影購物中心特價388 馬上下標等於一個才190幾以這價格她已經表現很優秀我是個超油肌超油肌所以都使用塞尚粉盒好用便宜 唯一就是粉比較粗 補妝太多次會整個臉裂掉的缺點之後發現好辦法就是另外帶一個粉撲在化妝包 補之前先把ㄧ些推掉一點 果然好多了!!!但1028這款補妝就沒這問題 因為粉夠細所以補多次一點也還算自然ok但我一點都不覺得控油耶!!! 好不持久的粉餅!!!!!!!!不知道是因為賽尚太控油還是怎樣 就得多補幾次但妝感讓人感覺很細緻不太像開架有的粉質算是有點濕軟的感覺SPF50讓我很燒!!!對了這款是我所有粉餅 唯一可以單擦的就是不上任何底 保養完直接上 很自然可能是濕軟特性所以比較好上讓我懶得上隔離 但又得出去 可以用這塊讓我心安一點 SPF50!!!!!但總結有這 種特惠組的價格買到這塊粉餅算是沒話說了粉盒質感也不錯 只是用量有點大對了 粉撲很難用  我用香奈兒的粉撲上就好多了但我還是會跟我心愛的塞尚一起輪著用有特惠是可以buy一下只是很白的人用這款 就一律用01吧因為我算黑肉底用02就算還可以很白很白的人可能不適合!!!!!,嚴重可能那幾天保養一樣 底妝只有乾擦它結果 用一兩禮拜 發現它 讓我左半臉開始大冒痘也不是那個要來 就是很平穩的時間竟然給我冒痘這款打入冷宮這款粉質非常細甚至比我的小香還細這款跟布朗尼眼影購物中心特價388 馬上下標等於一個才190幾以這價格她已經表現很優秀我是個超油肌超油肌所以都使用塞尚粉盒好用便宜 唯一就是粉比較粗 補妝太多次會整個臉裂掉的缺點之後發現好辦法就是另外帶一個粉撲在化妝包 補之前先把ㄧ些推掉一點 果然好多了但1028這款補妝就沒這問題 因為粉夠細所以補多次一點也還算自然ok但我一點都不覺得控油耶 好不持久的粉餅不知道是因為賽尚太控油還是怎樣 就得多補幾次但妝感讓人感覺很細緻不太像開架有的粉質算是有點濕軟的感覺SPF50讓我很燒對了這款是我所有粉餅 唯一可以單擦的就是不上任何底 保養完直接上 很自然可能是濕軟特性所以比較好上讓我懶得上隔離 但又得出去 可以用這塊讓我心安一點 SPF50但總結有這 種特惠組的價格買到這塊粉餅算是沒話說了粉盒質感也不錯 只是用量有點大對了 粉撲很難用  我用香奈兒的粉撲上就好多了但我還是會跟我心愛的塞尚一起輪著用有特惠是可以buy一下只是很白的人用這款 就一律用01吧因為我算黑肉底用02就算還可以很白很白的人可能不適合
"購買了01跟02各一個~01是自己使用 02是給媽咪的母親節禮物XD圖片看到的是0202之後再問媽咪使用的感想再來補充~雖然入手前就知道大家說粉撲很薄的事情,可是當我拿到手後真的無言了= =真的好薄好薄...而且重點是因為我要看一下我給我媽咪的是否沒受損,所以就打開02的起來看...結果發現了↓左邊是我01的粉噗  右邊是02的粉撲兩個粉撲的厚度跟質感竟然不一樣...讓我都在想是同一家公司出產的嗎 = =還是他是刻意這樣配置的...雖然說了這些,還是拿來使用看看了,剛抹上去時感覺挺白的 結果推開後還是一樣不夠白...遮毛孔的效果其實我覺得還滿好的,也能修飾泛紅,只是說~這款真的感覺會很容易用到凹凹我才剛用第一次1028的模樣已經模糊了= =而且不知道是甚麼東西用到鏡子,痕跡擦也擦不掉  很討厭...粉也一直到處飛...不過粉質是真的很細~~雖然沒有防曬係數不過這點是沒關係的,因為我都會另外擦上防曬~雖然我打了一大串感覺都是不好的感覺,不過其實我覺得用起來很貼妝,又挺遮毛孔修飾泛紅,其實大致上是不錯的.因為只是剛開始使用,之後如果有後續情形再來補充看看...如果可以在白一些就好了...2011/05/30今天很簡單的只有單上他...結果他竟然太乾讓我脫皮了Q口Q""""""我第一次遇到會讓我脫皮的粉餅...乾肌用起來可能真的會太乾了= =單用效果其實我覺得不怎麼OK改天再搭配粉底液試看看好了...2011/06/22因為之前單上的效果很讓我不滿意所以我就都把他拿來擦脖子減少色差...後來覺得很氣覺得不可能會是這樣的心態從新試過一次...我拿比較光澤感或是薄透的粉底液或BB霜在用這款1028在毛孔跟鼻子 鼻翼那邊按壓其他地方輕輕點推過效果卻異常的好!!尤其是毛孔~出油後根本被遮得好完美~~!!暗沉度我是覺得普通 只是會不明亮變成自然這時候在補一下妝就好單上可能是因為我皮膚容易暗沉","母親節禮物XD圖片看到的是0202之後再問媽咪使用的感想再來補充~雖然入手前就知道大家說粉撲很薄的事情,可是當我拿到手後真的無言了= =真的好薄好薄而且重點是因為我要看一下我給我媽咪的是否沒受損,所以就打開02的起來看結果發現了↓左邊是我01的粉噗  右邊是02的粉撲兩個粉撲的厚度跟質感竟然不一樣讓我都在想是同一家公司出產的嗎 = =還是他是刻意這樣配置的雖然說了這些,還是拿來使用看看了,剛抹上去時感覺挺白的 結果推開後還是一樣不夠白遮毛孔的效果其實我覺得還滿好的,也能修飾泛紅,只是說~這款真的感覺會很容易用到凹凹我才剛用第一次1028的模樣已經模糊了= =而且不知道是甚麼東西用到鏡子,痕跡擦也擦不掉  很討厭粉也一直到處飛不過粉質是真的很細雖然沒有防曬係數不過這點是沒關係的,因為我都會另外擦上防曬~雖然我打了一大串感覺都是不好的感覺,不過其實我覺得用起來很貼妝,又挺遮毛孔修飾泛紅,其實大致上是不錯的.因為只是剛開始使用,之後如果有後續情形再來補充看看如果可以在白一些就好了2011/05/30今天很簡單的只有單上他結果他竟然太乾讓我脫皮了Q口Q""""""我第一次遇到會讓我脫皮的粉餅乾肌用起來可能真的會太乾了= =單用效果其實我覺得不怎麼OK改天再搭配粉底液試看看好了2011/06/22因為之前單上的效果很讓我不滿意所以我就都把他拿來擦脖子減少色差後來覺得很氣覺得不可能會是這樣的心態從新試過一次我拿比較光澤感或是薄透的粉底液或BB霜在用這款1028在毛孔跟鼻子 鼻翼那邊按壓其他地方輕輕點推過效果卻異常的好尤其是毛孔~出油後根本被遮得好完美暗沉度我是覺得普通 只是會不明亮變成自然這時候在補一下妝就好單上可能是因為我皮膚容易暗沉"
又發1028連鎖心得 不曉得是生火還是滅火的一篇XD其實這塊昨天晚上才拿到的放學的時候一收到簡訊馬上就以飆仔的速度騎回家附近全家取貨其實也沒有這麼期待阿…我是在PAYEASY購入特惠組的比較了好幾家才下手以此檔來說PAYEASY算賣的滿便宜的感覺有划算到唷!因為同時還有購買凱文的傳名酸粉餅所以下面會附上跟1028的比較圖凱文的粉餅老實說白皙色滿偏紅的但是凱文的粉餅有附防塵套然後也是按壓式開關整體滿像是YSL那塊粉餅說..照片經過UR壓縮好像有點模糊大家將就點看囉@@撇開外盒的設計就如其他網友說的 滿有質感是滑面的珠光白色粉盒放置粉撲那邊也有透氣孔其實以價位來說挺滿意的了^^(左邊那塊是凱文的傳明酸 右邊是1028)但其實對這一塊粉餅有點小失望的地方沒想到粉質還是偏乾了一點以往使用的粉餅 真的會覺得粉體很重要只要是太乾的話 都會被我扣滿多分的另外就是粉撲真的好薄一片好可憐感覺真的輕輕一捏就要碎了而且感覺觸感不是很好所以還是換上了自己慣用的粉撲上粉自己的習慣是不太喜歡單用粉餅今天是下面上了BB霜(昨天在康是美新買的Kameria 凱蜜菈Baby BB霜)然後上面薄撲一層1028粉餅上去不知道是什麼原因 上完妝之後感覺肌膚沒有透亮感 反而有點色號不太適合的感覺不過當下急著出門上班也沒想那麼多了@@來到公司一看其實妝感又還不錯就是一般的霧面感這樣但是淺斑一樣是遮不太住毛孔的遮暇力適中 整體的感覺是還可以沒有特別驚艷的感覺但是差不多四個小時後我的臉就響起了嗶嗶警報果然不出乎意料額頭跟臉頰起了乾燥反應 粉有一點浮這樣可能這一塊還是不適合乾肌使用控油的能力比較好 導致我臉都有一點乾了@@不然整體來說滿喜歡這塊粉餅的可能這個季節使用還是不太適合所以會先收起來等到熱一點再用了最近遇到的粉餅都偏乾所以常用的還是固定那幾塊下次來去買夏日雪膚回到艾倫比亞的懷抱好了畢竟我秋冬那塊已經小凹凹了^^,一篇XD其實這塊昨天晚上才拿到的放學的時候一收到簡訊馬上就以飆仔的速度騎回家附近全家取貨其實也沒有這麼期待阿…我是在PAYEASY購入特惠組的比較了好幾家才下手以此檔來說PAYEASY算賣的滿便宜的感覺有划算到唷!因為同時還有購買凱文的傳名酸粉餅所以下面會附上跟1028的比較圖凱文的粉餅老實說白皙色滿偏紅的但是凱文的粉餅有附防塵套然後也是按壓式開關整體滿像是YSL那塊粉餅說照片經過UR壓縮好像有點模糊大家將就點看囉撇開外盒的設計就如其他網友說的 滿有質感是滑面的珠光白色粉盒放置粉撲那邊也有透氣孔其實以價位來說挺滿意的了^^但其實對這一塊粉餅有點小失望的地方沒想到粉質還是偏乾了一點以往使用的粉餅 真的會覺得粉體很重要只要是太乾的話 都會被我扣滿多分的另外就是粉撲真的好薄一片好可憐感覺真的輕輕一捏就要碎了而且感覺觸感不是很好所以還是換上了自己慣用的粉撲上粉自己的習慣是不太喜歡單用粉餅今天是下面上了BB霜然後上面薄撲一層1028粉餅上去不知道是什麼原因 上完妝之後感覺肌膚沒有透亮感 反而有點色號不太適合的感覺不過當下急著出門上班也沒想那麼多了來到公司一看其實妝感又還不錯就是一般的霧面感這樣但是淺斑一樣是遮不太住毛孔的遮暇力適中 整體的感覺是還可以沒有特別驚艷的感覺但是差不多四個小時後我的臉就響起了嗶嗶警報果然不出乎意料額頭跟臉頰起了乾燥反應 粉有一點浮這樣可能這一塊還是不適合乾肌使用控油的能力比較好 導致我臉都有一點乾了不然整體來說滿喜歡這塊粉餅的可能這個季節使用還是不太適合所以會先收起來等到熱一點再用了最近遇到的粉餅都偏乾所以常用的還是固定那幾塊下次來去買夏日雪膚回到艾倫比亞的懷抱好了畢竟我秋冬那塊已經小凹凹了^^
一開始用覺得還滿不錯的，但後來用了他牌就覺得還好，相較之下粉顏色有點明顯～,一開始用覺得還滿不錯的，但後來用了他牌就覺得還好，相較之下粉顏色有點明顯～
妝感很自然~~~但毛孔真的還是遮瑕力不夠~亮澤感也好像普通~~沒甚麼驚艷的感覺~~還是要多做一個打底的動作~~但我喜歡它的香味~~聞了心情很好,還是遮瑕力不夠~亮澤感也好像普通沒甚麼驚艷的感覺還是要多做一個打底的動作但我喜歡它的香味聞了心情很好
